<?xml version="1.0" encoding="utf-8" ?>
<sort xmlns:xsi="http://www.w3.org/2001/XMLSchema-instance" xsi:noNamespaceSchemaLocation="algebra.xsd">
  <parameters>
  </parameters>
  <input>
    <antijoin>
      <parameters>
        <equal_condition>
          <equals>
            <column name="c"/>
            <column name="a"/>
          </equals>
        </equal_condition>
        <column name="c"/>
      </parameters>
      <input>
        <table name="z">
          <column name="c" type="int"/>
          
        </table>
        <table name="x">
          <column name="a" type="int"/>
<index name="zc" type="clustered">
            <column name="a" order="desc"/>
          </index>
        </table>
      </input>

    </antijoin>
  </input>
</sort>