<?xml version="1.0" encoding="utf-8" ?>
<sort xmlns:xsi="http://www.w3.org/2001/XMLSchema-instance" xsi:noNamespaceSchemaLocation="algebra.xsd">
  <parameters>
    <parameter column="revenue" direction="desc" />
    <parameter column="o_orderdate" direction="asc" />
  </parameters>
  <input>
    <selection>
      <parameters>
        <condition>
          <boolean_predicate  name="like">
            <argument>
              <column name="x"/>
            </argument>
            <argument>
              <constant type="int" value="445" />
            </argument>
          </boolean_predicate>
        </condition>
      </parameters>
      <input>
        
      </input>
    </selection>
  </input>
</sort>