<?xml version="1.0" encoding="utf-8" ?>
<sort xmlns:xsi="http://www.w3.org/2001/XMLSchema-instance" xsi:noNamespaceSchemaLocation="algebra.xsd">
  <parameters>
    <parameter column="a" direction="desc"/>
    <parameter column="b" direction="desc"/>
  </parameters>
  <input>
    <table name="x" numberOfRows="10000">
      <column name="a" type="int" number_of_unique_values="10000"/>
      <column name="b" type="int" number_of_unique_values="10000"/>
      <index type="clustered" name="index">
        <column name="a" order="asc"/>
      </index>
    </table>
  </input>
</sort>