<?xml version="1.0" encoding="utf-8" ?>
<sort xmlns:xsi="http://www.w3.org/2001/XMLSchema-instance" xsi:noNamespaceSchemaLocation="algebra.xsd">
  <parameters>
  </parameters>
  <input>
    <antijoin>
      <parameters>
        <equal_condition>
          <equals>
            <column name="d"/>
            <column name="b"/>
          </equals>
        </equal_condition>
        <column name="d"/>
      </parameters>
      <input>
        <antijoin>
          <parameters>
            <equal_condition>
              <equals>
                <column name="c"/>
                <column name="a"/>
              </equals>
            </equal_condition>
            <column name="c" newName="d"/>
          </parameters>
          <input>
            <table name="z">
              <column name="c" type="int"/>
            </table>
            <table name="x">
              <column name="a" type="int"/>
            </table>
          </input>

        </antijoin>
        <table name="y">
          <column name="b" type="int"/>
        </table>
      </input>
    </antijoin>
  </input>
</sort>