<?xml version="1.0" encoding="utf-8" ?>
<sort xmlns:xsi="http://www.w3.org/2001/XMLSchema-instance" xsi:noNamespaceSchemaLocation="algebra.xsd">
  <parameters>
  </parameters>
  <input>
    <intersection>
      <input>
        <table name="people_from_city">
          <column name="name"/>
        </table>
        <table name="people_from_city">
          <column name="name" unique="true" />
        </table>
      </input>
    </intersection>
  </input>
</sort>