<?xml version="1.0" encoding="utf-8" ?>
<sort xmlns:xsi="http://www.w3.org/2001/XMLSchema-instance" xsi:noNamespaceSchemaLocation="algebra.xsd">
  <parameters>
  </parameters>
  <input>
    <join>
      <parameters>
        <equal_condition>
          <equals>
            <column name="a"/>
            <column name="b" />
          </equals>
        </equal_condition>
        <column name="a" input="first"/>
        <column name="b" input="second"/>
      </parameters>
      <input>
        <table name="p">
          <column name="a" type="int"/>
          <index name="indexa" type="clustered">
            <column name="a" order="asc"/>
          </index>
        </table>
        <table name="q">
          <column name="b" type="int"/>
          <index name="index" type="unclustered">
            <column name="b" order="asc"/>
          </index>
        </table>
      </input>
    </join>
  </input>
</sort>