<?xml version="1.0" encoding="utf-8" ?>
<sort xmlns:xsi="http://www.w3.org/2001/XMLSchema-instance" xsi:noNamespaceSchemaLocation="algebra.xsd">
  <parameters>
    <parameter column="a" direction="asc"/>
  </parameters>
  <input>
    <selection>
      <parameters>
        <condition>
          <lower>
            <column name="a"/>
            <constant type="int" value="5"/>
          </lower>
        </condition>
      </parameters>
      <input>
        <table name="x" numberOfRows="100000">
          <column name="a" type="int" number_of_unique_values="50000"/>
          <index name="index" type="unclustered">
            <column name="a" order="asc"/>
          </index>
        </table>
      </input>
    </selection>
  </input>
</sort>