<?xml version="1.0" encoding="utf-8" ?>
<sort xmlns:xsi="http://www.w3.org/2001/XMLSchema-instance" xsi:noNamespaceSchemaLocation="algebra.xsd">
  <parameters>
  </parameters>
  <input>
    <union>
      <input>
        <table name="people_from_city">
          <column name="name" type="string" />
        </table>
        <union>
          <input>
            <table name="people_from_city">
              <column name="name" type="string"/>
            </table>
            <table name="people_from_city">
              <column name="name" type="string" />
            </table>
          </input>
        </union>   
      </input>
    </union>
  </input>
</sort>