<?xml version="1.0" encoding="utf-8" ?>
<sort xmlns:xsi="http://www.w3.org/2001/XMLSchema-instance" xsi:noNamespaceSchemaLocation="algebra.xsd">
  <parameters>
    <parameter column="revenue" direction="desc" />
    <parameter column="o_orderdate" direction="asc" />
  </parameters>
  <input>
    <group>
      <parameters>
        <group_by column="l_orderkey"/>
        <group_by column="o_orderdate" />
        <group_by column="o_shippriority"/>
        <sum argument="x" output="revenue"/>
      </parameters>
      <input>
        <column_operations>
          <parameters>
            <column name="l_orderkey"></column>
            <column name="o_orderdate"></column>
            <column name="o_shippriority"></column>
            <column name="x">
              <equals>
                <times>
                  <column name="l_extendedprice"/>
                  <minus>
                    <constant type="double" value="1"/>
                    <column name="l_discount"/>
                  </minus>
                </times>
              </equals>
            </column>
          </parameters>
          <input>
            <join>
              <parameters>
                <equal_condition>
                  <equals>
                    <column name="c_custkey"/>
                    <column name="o_custkey"/>
                  </equals>
                </equal_condition>
                <column name="l_orderkey" input="second"/>
                <column name="o_orderdate" input="second"/>
                <column name="o_shippriority" input="second"/>
                <column name="l_extendedprice" input="second"/>
                <column name="l_discount" input="second"/>
              </parameters>
              <input>
                <selection>
                  <parameters>
                    <condition>
                      <equals>
                        <column name="c_mktsegment"/>
                        <constant type="string" value="SEGMENT"/>
                      </equals>
                    </condition>
                  </parameters>
                  <input>
                    <table name="customer" numberOfRows="150000">
                      <column name="c_custkey" type="int" />
                      <column name="c_mktsegment" type="int"/>
                      <index type="unclustered" name="index2">
                        <column name="c_mktsegment" order="asc" />
                      </index>
                    </table>
                  </input>
                </selection>
                <join>
                  <parameters>
                    <equal_condition>
                      <equals>
                        <column name="l_orderkey"/>
                        <column name="o_orderkey"/>
                      </equals>
                    </equal_condition>
                    <column name="l_orderkey" input="first"/>
                    <column name="o_orderdate" input="second"/>
                    <column name="o_shippriority" input="second"/>
                    <column name="l_extendedprice" input="first"/>
                    <column name="l_discount" input="first"/>
					<column name="o_custkey" input="second"/>
                  </parameters>
                  <input>
                    <selection>
                      <parameters>
                        <condition>
                          <lower>
                            <constant type="date" value="today"/>
                            <column name="l_shipdate"/>
                          </lower>
                        </condition>
                      </parameters>
                      <input>
                        <table name="lineitem" numberOfRows="6000000">
                          <column name="l_orderkey" type="int"></column>
                          <column name="l_shipdate" type="int"/>
                          <column name="l_extendedprice" type="int"/>
                          <column name="l_discount" type="int"/>
                        </table>
                      </input>
                    </selection>
                    <selection>
                      <parameters>
                        <condition>
                          <lower>
                            <column name="o_orderdate"/>
                            <constant type="date" value="today"/>
                          </lower>
                        </condition>
                      </parameters>
                      <input>
                        <table name="orders" numberOfRows="1500000">
                          <column name="o_orderdate" type="int"/>
                          <column name="o_shippriority" type="int"/>
                          <column name="o_orderkey" type="int"/>
                          <column name="o_custkey" type="int" />
                          <index type="clustered" name="index">
                            <column name="o_orderdate" order="asc" />
                            <column name="o_shippriority" order="asc" />
                          </index>
                        </table>
                      </input>
                    </selection>
                  </input>
                </join>
              </input>
            </join>
          </input>
        </column_operations>
      </input>
    </group>
  </input>
</sort>