<?xml version="1.0" encoding="utf-8" ?>
<sort xmlns:xsi="http://www.w3.org/2001/XMLSchema-instance" xsi:noNamespaceSchemaLocation="algebra.xsd">
  <parameters>
    <parameter column="revenue" direction="desc" />
    <parameter column="o_orderdate" direction="asc" />
  </parameters>
  <input>
    <column_operations>
      <parameters>
        <column>
          <equals>
            <aritmetic_function name ="sqrt">
              <argument>
                <constant type="double" value="2"/>
              </argument>
            </aritmetic_function>
          </equals>
        </column>
      </parameters>
      <input>
        
      </input>
    </column_operations>
    </selection>
  </input>
</sort>