<?xml version="1.0" encoding="utf-8" ?>
<sort xmlns:xsi="http://www.w3.org/2001/XMLSchema-instance" xsi:noNamespaceSchemaLocation="algebra.xsd">
  <parameters>
  </parameters>
  <input>
    <selection>
      <parameters>
        <condition>
          <and>
            <and>
              <equals>
                <column name="a"/>
                <costant type="int" value="4"/>
              </equals>
              <equals>
                <column name="b"/>
                <costant type="int" value="10"/>
              </equals>
            </and>
            <and>
              <lower>
                <column name="a"/>
                <costant type="int" value="-1"/>
              </lower>
              <lower>
                <column name="b"/>
                <costant type="int" value="8000"/>
              </lower>
            </and>
          </and>
        </condition>
      </parameters>
      <input>
        <table name="users" numberOfRows="10000000">
          <column name="a" type="int" number_of_unique_values="1000" />
          <column name="b" type="int" number_of_unique_values="1000" />
          <index type="unclustered" >
            <column name="a" />
            <column name="b" />
          </index>
        </table>
      </input>
    </selection>
  </input>
</sort>